{
  "$schema": "http://json-schema.org/draft-07/schema#",
  "$id": "https://simplyzombies.dev/schemas/raider.schema.json",
  "title": "Raider archetype",
  "description": "An armed hostile human, drawn by the director as a band and walked in from the edge of the district. A raider is a survivor-shaped body with `allegiance.faction` set to a side that is not the colony -- everything that then happens to them (melee, ranged, wounds, bleeding, being chased by zombies) is machinery that already existed, so adding an archetype is a JSON file and no code. Deliberately NOT a survivor entry: the survivor schema forbids unknown keys and its validator enforces aptitudes summing to 15, `SimSurvivors.list_uniques` boots everything under survivors/ whose id starts with survivor.unique., and the frozen TypeScript oracle reads a fixed list of content directories, which this one is not on. NOTE: the Godot content validator is shallow -- it checks top-level types, enums and patterns and rejects unexpected top-level keys, but does not recurse into `aptitudes`, `kit` or `appearance`. check_m2_raiders.gd is the gate that does, and it is why a wrong key inside a nested block cannot sit here unnoticed the way one did in item.wrap.cloth's armor block.",
  "type": "object",
  "required": ["id", "name", "allegiance", "kit"],
  "additionalProperties": false,
  "properties": {
    "id": {
      "type": "string",
      "pattern": "^raider\\.[a-z0-9_]+$",
      "description": "Stable namespaced id. Permanent once shipped."
    },
    "name": { "type": "string", "description": "Human-readable archetype name." },
    "allegiance": { "$ref": "#/$defs/faction" },
    "role": {
      "type": "string",
      "enum": ["fighter", "lookout", "looter"],
      "default": "fighter",
      "description": "What this archetype came to do, matched in SimRaiders._approach. `fighter` is the band that walks at the gate and fights until its withdrawal clock runs out, which is what every archetype did before roles existed. `lookout` halts SimRaiders.LOOKOUT_METRES short of the objective, never closes, and turns the whole band for home on the first casualty rather than at the half strength the shared clause waits for. `looter` walks at the colony's stores instead of its gate -- the nearest SimNeeds.is_stockpile_tile inside SimHome.rect -- takes LOOT_TAKE items off the floor and withdraws with them, and what it carries out is despawned rather than dropped, which is docs/18's 'target stores first, people second, and will withdraw once loaded'. A CLOSED enum and never a free string: the Godot validator does check a top-level enum, and SimRaiders.spawn refuses a role it does not implement rather than falling back to fighter, because an archetype that reads as shipped behaviour and silently is not is the most expensive shape of dead socket this milestone has. Omitted counts as `fighter`. A role is deliberately INVISIBLE to the player -- it changes nothing about dress, look or sprite, exactly as which archetype carries the gun does not (see the appearance note below); what gives a looter away is that it walks past you towards the pantry, which is behaviour and is earned."
    },
    "weight": {
      "type": "integer",
      "minimum": 1,
      "description": "Relative draw weight within a band. Omitted counts as 1."
    },
    "speed": {
      "type": "number",
      "minimum": 0,
      "description": "Approach speed in metres per second. Between a shambler's walk and a colonist hurrying to a job: a band on its way somewhere, not a charge."
    },
    "aptitudes": {
      "type": "object",
      "description": "STR/DEX/CON, same three the survivor generator rolls and the same 3..8 clamp SimAptitudes applies. Unlike a survivor entry these are not budget-checked -- a raider is not a colonist and does not draw from the colony's 15 points. A value is either one number, which every body of the archetype shares, or a two-element [min, max] range rolled per body on the `raiderRoll` stream: two scavengers are not the same man, and the jitter is what makes one fight go differently from the next. check_m2_raiders.gd recurses both shapes, because the shallow validator cannot see inside this block.",
      "additionalProperties": false,
      "properties": {
        "str": { "$ref": "#/$defs/aptitude" },
        "dex": { "$ref": "#/$defs/aptitude" },
        "con": { "$ref": "#/$defs/aptitude" }
      }
    },
    "kit": {
      "type": "array",
      "minItems": 1,
      "description": "What this archetype arrives carrying. Anything with an equipSlot goes into the hand it belongs to (a weapon in a satchel raises no meleeWeapon and would make the raid a walk); the rest goes in the pack. An entry is a bare item id, or an object when the quantity or the odds matter -- ammunition forced the first, since a pistol arriving with a single round is a raider who fires once and then reloads for the rest of the night, and telling one body of a band from another forced the second. Every id must exist in the item registry and every count must be a positive integer; check_m2_raiders.gd asserts both, because the shallow validator cannot see inside an array.",
      "items": {
        "oneOf": [
          { "type": "string", "pattern": "^item\\.[a-z0-9_]+(\\.[a-z0-9_]+)*$" },
          {
            "type": "object",
            "required": ["item"],
            "additionalProperties": false,
            "properties": {
              "item": { "type": "string", "pattern": "^item\\.[a-z0-9_]+(\\.[a-z0-9_]+)*$" },
              "count": {
                "type": "integer",
                "minimum": 1,
                "description": "Quantity for a stackable base. SimItems clamps it to the base's own stack limit."
              },
              "chance": {
                "type": "number",
                "exclusiveMinimum": 0,
                "maximum": 1,
                "description": "Odds this row arrives at all, rolled per body on the `raiderRoll` stream; a row that declares none always arrives. This is what makes two scavengers carry different things -- and it belongs on the extras, never on the weapon: a second weapon behind odds is a raider who sometimes also has a knife, but an archetype whose every armed row could roll away would send an unarmed pedestrian at your gate, which is why check_m2_raiders.gd requires each archetype to declare at least one weapon that always arrives."
              }
            }
          }
        ]
      }
    },
    "appearance": { "$ref": "#/$defs/appearance" },
    "skills": {
      "type": "array",
      "uniqueItems": true,
      "description": "What this archetype has already learned: node ids from colony/skill_web.json, granted at spawn with no points spent, so the same web every survivor walks is the one a raider arrives on (docs/30, 'One web, and the captives'). Nodes rather than points, because a raider has no focus row and points would be spent by the Auto path and the surplus pass, never by the author. Every id must be a node in the web; check_m2_raiders.gd asserts it, because the shallow validator cannot see inside an array.",
      "items": { "type": "string", "pattern": "^[a-z]+\\.[a-z_]+$" }
    }
  },
  "$defs": {
    "faction": {
      "type": "string",
      "enum": ["raiders", "settlers"],
      "description": "Which side this archetype fights on, copied onto the spawned body's `allegiance` component and read by SimAllegiance.hostile. Two values since the allegiance seam widened: `raiders` is the band at the gate, `settlers` a third side that is hostile to the raiders and at peace with the colony. `colony` is deliberately NOT here -- an archetype declaring it would be a colonist spawned outside the roster, with no needs and no place on the ledger. One `$defs` entry rather than an inline enum so there is exactly one definition of what a faction may be; note the Godot content validator does not resolve `$ref`, so this enum's reader is check_m2_allegiance.gd, which walks the shipped entries against SimAllegiance's own constants and refuses a value that is in neither.",
      "default": "raiders"
    },
    "aptitude": {
      "oneOf": [
        { "type": "integer", "minimum": 3, "maximum": 8 },
        {
          "type": "array",
          "minItems": 2,
          "maxItems": 2,
          "items": { "type": "integer", "minimum": 3, "maximum": 8 },
          "description": "[min, max], inclusive, rolled per body. min may equal max."
        }
      ]
    },
    "appearance": {
      "type": "object",
      "description": "What this ARCHETYPE looks like, and it is still one body for all of them: which raider is carrying the gun is exactly the sort of certainty the hardcore contract's information clause refuses the player, so a second sprite here would be a free read on the band's loadout. Omit the block entirely and presentation/appearance.gd falls back to the `raider` role colour, which is the normal state until art exists. Since the individuals slice a raider ALSO carries a rolled `raider.person.look`, one id from `content/colony/raider_looks.json` resolved in `content/colony/looks.json`, and the renderer prefers it over this block. That pool is drawn on its own stream with no idea which archetype asked, so a scav and a gunhand can and do wear the same one; every entry in it declares this same sprite and this same tint -- since 2026-09-26 the one pack survivor every human wears, under the one raider tint that keeps a raider from reading as one of your own (docs/30, 'The whole outpost pack'; check_m2_raiders.gd's LOOKS lane holds it to one tint, never two). So a look says nothing about a body today and is the hook per-body art attaches to; what a raider visibly varies by is what they are WEARING, which is kit -- and the worn rows must be identical across archetypes at identical odds, or a cap would answer 'which one has the gun'. NO-TELL is that sentence made mechanical.",
      "additionalProperties": false,
      "properties": {
        "hitFx": {
          "type": "string",
          "pattern": "^fx_[a-z0-9_]+$",
          "description": "The effect sheet a blow drawn on this body plays where it lands (docs/23, 'The shot is seen'): an authored `sheet` family in godot/assets/sprites/authored.json, played by presentation/fx_look.gd on `attack.connected` and `bite.landed` when the player sees the body. One picture for every blow -- a scratch, a bite, a graze and a killing shot draw the identical frames, because the sheet is chosen by who was struck and never by what struck them or how hard (docs/01 clause 4: a bite can present as a scratch)."
        },
        "sprite": {
          "type": "string",
          "pattern": "^[a-z0-9_.]+$",
          "description": "Registry key, resolved to assets/sprites/<key>.png. A key, not a path."
        },
        "tint": {
          "type": "string",
          "pattern": "^#[0-9a-f]{6}$",
          "description": "Colour for the procedural fallback, and a modulate over the sprite when one exists."
        }
      }
    }
  }
}
