{
  "id": "raider.scav",
  "name": "Scavenger",
  "allegiance": "raiders",
  "role": "fighter",
  "weight": 4,
  "speed": 1.5,
  "aptitudes": { "str": [5, 7], "dex": [4, 6], "con": [4, 6] },
  "appearance": { "sprite": "body_survivor", "tint": "#c4877a", "hitFx": "fx_blood_hit" },
  "skills": ["melee.grip"],
  "kit": [
    "item.machete.rusted",
    { "item": "item.bandage.cloth", "chance": 0.5 },
    { "item": "item.food.canned", "chance": 0.5 },
    { "item": "item.water.bottle", "chance": 0.5 },
    { "item": "item.cap.canvas", "chance": 0.5 },
    { "item": "item.pack.school", "chance": 0.4 }
  ]
}
