{
  "id": "raider.gunhand",
  "name": "Gunhand",
  "allegiance": "raiders",
  "role": "fighter",
  "weight": 1,
  "speed": 1.4,
  "aptitudes": { "str": [4, 6], "dex": [5, 7], "con": [4, 6] },
  "appearance": { "sprite": "raider_body" },
  "kit": [
    "item.pistol.service",
    { "item": "item.ammo.9mm", "count": 16 },
    { "item": "item.bandage.cloth", "chance": 0.5 },
    { "item": "item.knife.kitchen", "chance": 0.5 },
    { "item": "item.food.canned", "chance": 0.5 },
    { "item": "item.cap.canvas", "chance": 0.5 },
    { "item": "item.pack.school", "chance": 0.4 }
  ]
}
